{
  "type": "object",
  "additionalProperties": false,
  "title": "Event Sports Stream Message",
  "$schema": "http://json-schema.org/draft-07/schema#",
  "definitions": {
    "Origin": {
      "type": "object",
      "properties": {
        "environment": {
          "oneOf": [
            {
              "type": "null",
              "title": "Not included"
            },
            {
              "type": "string"
            }
          ]
        },
        "type": {
          "oneOf": [
            {
              "type": "null",
              "title": "Not included"
            },
            {
              "type": "string"
            }
          ]
        },
        "stream": {
          "oneOf": [
            {
              "type": "null",
              "title": "Not included"
            },
            {
              "type": "string"
            }
          ]
        },
        "version": {
          "oneOf": [
            {
              "type": "null",
              "title": "Not included"
            },
            {
              "type": "string"
            }
          ]
        }
      },
      "additionalProperties": false
    },
    "Sport": {
      "type": "object",
      "properties": {
        "title": {
          "oneOf": [
            {
              "type": "null",
              "title": "Not included"
            },
            {
              "type": "string"
            }
          ]
        },
        "id": {
          "oneOf": [
            {
              "type": "null",
              "title": "Not included"
            },
            {
              "type": "string"
            }
          ]
        }
      },
      "additionalProperties": false
    },
    "League": {
      "type": "object",
      "properties": {
        "format": {
          "oneOf": [
            {
              "type": "null",
              "title": "Not included"
            },
            {
              "type": "string"
            }
          ]
        },
        "title": {
          "oneOf": [
            {
              "type": "null",
              "title": "Not included"
            },
            {
              "type": "string"
            }
          ]
        },
        "id": {
          "oneOf": [
            {
              "type": "null",
              "title": "Not included"
            },
            {
              "type": "string"
            }
          ]
        }
      },
      "additionalProperties": false
    },
    "Score": {
      "type": "object",
      "properties": {
        "awayTeam": {
          "oneOf": [
            {
              "type": "null",
              "title": "Not included"
            },
            {
              "type": "integer"
            }
          ]
        },
        "homeTeam": {
          "oneOf": [
            {
              "type": "null",
              "title": "Not included"
            },
            {
              "type": "integer"
            }
          ]
        }
      },
      "additionalProperties": false
    },
    "LiveGamePeriod": {
      "type": "object",
      "properties": {
        "name": {
          "oneOf": [
            {
              "type": "null",
              "title": "Not included"
            },
            {
              "type": "string"
            }
          ]
        },
        "id": {
          "oneOf": [
            {
              "type": "null",
              "title": "Not included"
            },
            {
              "type": "string"
            }
          ]
        }
      },
      "additionalProperties": false
    },
    "EventInfo": {
      "type": "object",
      "properties": {
        "country": {
          "oneOf": [
            {
              "type": "null",
              "title": "Not included"
            },
            {
              "$ref": "#/definitions/Country"
            }
          ]
        },
        "teams": {
          "oneOf": [
            {
              "type": "null",
              "title": "Not included"
            },
            {
              "$ref": "#/definitions/Teams"
            }
          ]
        },
        "league": {
          "oneOf": [
            {
              "type": "null",
              "title": "Not included"
            },
            {
              "$ref": "#/definitions/League"
            }
          ]
        },
        "liveGamePeriod": {
          "oneOf": [
            {
              "type": "null",
              "title": "Not included"
            },
            {
              "$ref": "#/definitions/LiveGamePeriod"
            }
          ]
        },
        "id": {
          "oneOf": [
            {
              "type": "null",
              "title": "Not included"
            },
            {
              "type": "string"
            }
          ]
        },
        "state": {
          "oneOf": [
            {
              "type": "null",
              "title": "Not included"
            },
            {
              "type": "string"
            }
          ]
        },
        "liveMinute": {
          "oneOf": [
            {
              "type": "null",
              "title": "Not included"
            },
            {
              "type": "integer"
            }
          ]
        },
        "marketsCount": {
          "oneOf": [
            {
              "type": "null",
              "title": "Not included"
            },
            {
              "type": "integer"
            }
          ]
        },
        "sport": {
          "oneOf": [
            {
              "type": "null",
              "title": "Not included"
            },
            {
              "$ref": "#/definitions/Sport"
            }
          ]
        },
        "startDate": {
          "oneOf": [
            {
              "type": "null",
              "title": "Not included"
            },
            {
              "type": "string"
            }
          ]
        },
        "status": {
          "oneOf": [
            {
              "type": "null",
              "title": "Not included"
            },
            {
              "type": "string"
            }
          ]
        },
        "timeRange": {
          "oneOf": [
            {
              "type": "null",
              "title": "Not included"
            },
            {
              "type": "string"
            }
          ]
        }
      },
      "additionalProperties": false
    },
    "LiveScores": {
      "type": "object",
      "properties": {
        "lineEntity": {
          "oneOf": [
            {
              "type": "null",
              "title": "Not included"
            },
            {
              "$ref": "#/definitions/LineEntity"
            }
          ]
        },
        "away": {
          "oneOf": [
            {
              "type": "null",
              "title": "Not included"
            },
            {
              "type": "integer"
            }
          ]
        },
        "gamePeriod": {
          "oneOf": [
            {
              "type": "null",
              "title": "Not included"
            },
            {
              "$ref": "#/definitions/GamePeriod"
            }
          ]
        },
        "home": {
          "oneOf": [
            {
              "type": "null",
              "title": "Not included"
            },
            {
              "type": "integer"
            }
          ]
        }
      },
      "additionalProperties": false
    },
    "Country": {
      "type": "object",
      "properties": {
        "title": {
          "oneOf": [
            {
              "type": "null",
              "title": "Not included"
            },
            {
              "type": "string"
            }
          ]
        },
        "id": {
          "oneOf": [
            {
              "type": "null",
              "title": "Not included"
            },
            {
              "type": "string"
            }
          ]
        }
      },
      "additionalProperties": false
    },
    "Teams": {
      "type": "object",
      "properties": {
        "away": {
          "oneOf": [
            {
              "type": "null",
              "title": "Not included"
            },
            {
              "$ref": "#/definitions/Team"
            }
          ]
        },
        "home": {
          "oneOf": [
            {
              "type": "null",
              "title": "Not included"
            },
            {
              "$ref": "#/definitions/Team"
            }
          ]
        }
      },
      "additionalProperties": false
    },
    "GamePeriod": {
      "type": "object",
      "properties": {
        "name": {
          "oneOf": [
            {
              "type": "null",
              "title": "Not included"
            },
            {
              "type": "string"
            }
          ]
        },
        "id": {
          "oneOf": [
            {
              "type": "null",
              "title": "Not included"
            },
            {
              "type": "string"
            }
          ]
        }
      },
      "additionalProperties": false
    },
    "Team": {
      "type": "object",
      "properties": {
        "name": {
          "oneOf": [
            {
              "type": "null",
              "title": "Not included"
            },
            {
              "type": "string"
            }
          ]
        },
        "id": {
          "oneOf": [
            {
              "type": "null",
              "title": "Not included"
            },
            {
              "type": "string"
            }
          ]
        }
      },
      "additionalProperties": false
    },
    "LineEntity": {
      "type": "object",
      "properties": {
        "name": {
          "oneOf": [
            {
              "type": "null",
              "title": "Not included"
            },
            {
              "type": "string"
            }
          ]
        },
        "id": {
          "oneOf": [
            {
              "type": "null",
              "title": "Not included"
            },
            {
              "type": "string"
            }
          ]
        }
      },
      "additionalProperties": false
    }
  },
  "properties": {
    "eventInfo": {
      "oneOf": [
        {
          "type": "null",
          "title": "Not included"
        },
        {
          "$ref": "#/definitions/EventInfo"
        }
      ]
    },
    "origin": {
      "oneOf": [
        {
          "type": "null",
          "title": "Not included"
        },
        {
          "$ref": "#/definitions/Origin"
        }
      ]
    },
    "additionalInfo": {
      "oneOf": [
        {
          "type": "null",
          "title": "Not included"
        },
        {
          "type": "string"
        }
      ]
    },
    "id": {
      "oneOf": [
        {
          "type": "null",
          "title": "Not included"
        },
        {
          "type": "string"
        }
      ]
    },
    "liveScores": {
      "oneOf": [
        {
          "type": "null",
          "title": "Not included"
        },
        {
          "type": "array",
          "items": {
            "$ref": "#/definitions/LiveScores"
          }
        }
      ]
    },
    "typedScores": {
      "oneOf": [
        {
          "type": "null",
          "title": "Not included"
        },
        {
          "type": "object",
          "additionalProperties": {
            "type": "object",
            "additionalProperties": {
              "$ref": "#/definitions/Score"
            }
          }
        }
      ]
    },
    "timestamp": {
      "oneOf": [
        {
          "type": "null",
          "title": "Not included"
        },
        {
          "type": "string"
        }
      ]
    }
  }
}