{
  "origin": {
    "stream": "sport",
    "type": "event",
    "environment": "prod",
    "version": "1.0.0"
  },
  "id": "6540840",
  "eventInfo": {
    "id": "6540840",
    "state": "live",
    "status": "running",
    "liveGamePeriod": {
      "name": "2h"
    },
    "liveMinute": 0,
    "marketsCount": 0,
    "startDate": "2023-08-29 11:30:00+0000",
    "timeRange": "today",
    "sport": {
      "id": "1",
      "title": "Football",
      "key": "soccer"
    },
    "country": {
      "id": "1",
      "title": "International"
    },
    "league": {
      "id": "16596",
      "title": "Esoccer Friendly - 15 mins play"
    },
    "teams": {
      "home": {
        "id": "206115",
        "name": "Everton Virtual",
        "color": ""
      },
      "away": {
        "id": "208486",
        "name": "Juventus Virtual",
        "color": ""
      }
    }
  },
  "liveScores": [
    {
      "lineEntity": {
        "id": "1",
        "name": "goals"
      },
      "gamePeriod": {
        "id": "2",
        "name": "ft"
      },
      "home": 0,
      "away": 1
    },
    {
      "lineEntity": {
        "id": "3",
        "name": "red_cards"
      },
      "gamePeriod": {
        "id": "2",
        "name": "ft"
      },
      "home": 0,
      "away": 0
    }
  ],
  "typedScores": {
    "red_cards": {
      "ft": {
        "homeTeam": 0,
        "awayTeam": 0
      }
    },
    "goals": {
      "ft": {
        "homeTeam": 0,
        "awayTeam": 1
      }
    }
  },
  "timestamp": "2023-08-29 11:44:40.347+0000"
}